{
  "id": "capset-1",
  "schemaVersion": "1.2.0",
  "version": "1.0.0",
  "identity": {"name": "runtime-a", "revision": "r7"},
  "declaredAt": "2026-01-01T00:00:00Z",
  "specVersions": ["1.0.0", "1.1.0", "1.2.0"],
  "adapterFamilies": [{"family": "cli", "revision": "3"}],
  "effectClasses": ["file.read", "file.write", "shell.exec"],
  "workspace": {"workspace": "write", "filesystem": "read", "git": "read", "process": "allow", "network": "deny", "secret": "none"},
  "checkpointImport": true,
  "checkpointExport": true,
  "resumeSupport": true,
  "eventStreaming": true,
  "readProjection": true,
  "locality": "local",
  "privacyClasses": ["tenant-isolated"],
  "maxStructuredInput": 1048576,
  "maxStructuredOutput": 1048576,
  "budgetCeilings": {"tokens": 100000},
  "evidenceAttachment": true,
  "validation": true,
  "approvalEscalation": false
}
